{
  "allowed_nonclaims": [
    "physical hardware not run",
    "native Windows runtime not run"
  ],
  "description": "Operator software and scripted-device readiness without packaging handoff.",
  "final_verdicts": [
    "OPERATOR_SOFTWARE_READY",
    "PHYSICAL_HARDWARE_NOT_RUN"
  ],
  "plan_id": "operator_ready",
  "stages": [
    "00_repository_preflight",
    "10_naming_concordance",
    "20_launcher_validation",
    "30_frontend_runtime_validation",
    "40_operator_workflow_validation",
    "50_scripted_scale_validation",
    "60_zero_tare_calibration_validation",
    "70_recovery_validation",
    "80_windows_source_validation"
  ],
  "version": "0.1.7"
}
