{
  "allowed_nonclaims": [
    "physical hardware not run",
    "firmware compile/upload not run"
  ],
  "description": "Preconditions Cursor must satisfy before connecting UNO R3, HX711, and load cell.",
  "final_verdicts": [
    "CURSOR_READY",
    "PHYSICAL_HARDWARE_NOT_RUN"
  ],
  "plan_id": "physical_integration_prerequisites",
  "stages": [
    "00_repository_preflight",
    "10_naming_concordance",
    "20_launcher_validation",
    "30_frontend_runtime_validation",
    "40_operator_workflow_validation",
    "50_scripted_scale_validation",
    "60_zero_tare_calibration_validation",
    "70_recovery_validation",
    "80_windows_source_validation",
    "90_context_manifest_validation"
  ],
  "version": "0.1.9"
}
